id,name,description,thumbnail,price,rating
1,Nokia 6210 Navigator,justo maecenas rhoncus aliquam lacus morbi quis tortor id nulla ultrices aliquet maecenas leo odio condimentum id,https://cdn.tgdd.vn/Products/Images/42/207956/nokia-220-4g-cam-thumb-600x600.jpg,872,4.8
2,Sony Xperia XZ Premium,eget orci vehicula condimentum curabitur in libero ut massa volutpat convallis morbi odio odio elementum eu interdum eu tincidunt in,https://consumer.huawei.com/content/dam/huawei-cbg-site/common/mkt/list-image/phones/mate-9-pro/mate-9-pro-listimage-black.png,745,3.8
3,alcatel OT-105,at vulputate vitae nisl aenean lectus pellentesque eget nunc donec quis orci eget orci vehicula condimentum curabitur in libero ut,https://cdn.pixabay.com/photo/2017/03/04/12/03/mobile-phone-2115903_1280.png,864,3.9
4,Huawei Mate 9 Pro,volutpat quam pede lobortis ligula sit amet eleifend pede libero quis orci nullam molestie nibh in lectus pellentesque,https://www.quynhanmobile.com/wp-content/uploads/2020/10/mate-9.jpg,372,4.3
5,Nokia 1616,in faucibus orci luctus et ultrices posuere cubilia curae duis faucibus accumsan odio curabitur convallis duis consequat,https://encrypted-tbn0.gstatic.com/images?q=tbn:ANd9GcR75plDboaCaykSEkufjcw1rDgBRnGBcBqXMg&s,981,4.7
6,alcatel One Touch Evo 7 HD,massa tempor convallis nulla neque libero convallis eget eleifend luctus ultricies eu nibh quisque id justo sit amet,https://i5.walmartimages.com/seo/AT-T-Alcatel-Volta-16GB-Suede-Gray-Prepaid-Smartphone_3ac56611-d2be-47fc-9479-7c2fb37447f5.1ad63f4f3b032f55af97109220640ffd.jpeg,200,3.3
7,ZTE U880E,natoque penatibus et magnis dis parturient montes nascetur ridiculus mus etiam vel augue vestibulum rutrum,https://viostore.vn/wp-content/uploads/2024/12/101.png,479,4.6
8,Panasonic A100 Series,in sapien iaculis congue vivamus metus arcu adipiscing molestie hendrerit at vulputate,https://cdn.viettablet.com/images/detailed/61/zte-nubia-flip-1.jpg,272,4.8
9,Plum Gator 3,duis bibendum morbi non quam nec dui luctus rutrum nulla tellus,https://naza.vn/wp-content/uploads/2024/05/Dien-Thoai-ZTE-nubia-neo-5g-1.jpg,848,3.8
10,Samsung Galaxy A5,tempor turpis nec euismod scelerisque quam turpis adipiscing lorem vitae,https://vnmedia.vn/file/8a10a0d36ccebc89016ce0c6fa3e1b83/122022/zte-nubia-z50-3_20221220111411.jpg,795,2.9
11,Motorola MOTOKEY Mini EX109,aliquet maecenas leo odio condimentum id luctus nec molestie sed justo pellentesque viverra pede,Goldenrod,388,3.2
12,Samsung Galaxy Camera GC100,non pretium quis lectus suspendisse potenti in eleifend quam a,Violet,364,1.2
13,Nokia 5200,felis donec semper sapien a libero nam dui proin leo odio porttitor id consequat,Purple,274,1.3
14,Huawei U8180 IDEOS X1,in est risus auctor sed tristique in tempus sit amet sem fusce consequat nulla nisl nunc nisl duis bibendum,Purple,380,3.6
15,Huawei P8lite,lectus pellentesque eget nunc donec quis orci eget orci vehicula,Red,831,3.7
16,BLU Dash C Music,quis turpis sed ante vivamus tortor duis mattis egestas metus aenean fermentum donec ut mauris eget massa tempor,Indigo,283,1.0
17,BLU G5 Plus,vel pede morbi porttitor lorem id ligula suspendisse ornare consequat lectus in est risus auctor sed tristique in,Mauv,557,4.1
18,Toshiba TS803,massa id lobortis convallis tortor risus dapibus augue vel accumsan tellus nisi eu orci mauris lacinia sapien,Goldenrod,580,3.1
19,Nokia 6300,faucibus orci luctus et ultrices posuere cubilia curae duis faucibus accumsan odio curabitur convallis duis consequat dui nec nisi,Orange,193,1.1
20,Qtek 8080,lorem vitae mattis nibh ligula nec sem duis aliquam convallis nunc,Green,255,2.4
21,Celkon C203,cras in purus eu magna vulputate luctus cum sociis natoque penatibus et,Khaki,302,1.3
22,Sony Ericsson Live with Walkman,pede justo eu massa donec dapibus duis at velit eu est congue,Teal,993,1.2
23,Huawei nova 7 SE 5G Youth,venenatis non sodales sed tincidunt eu felis fusce posuere felis sed lacus morbi sem mauris,Pink,634,4.7
24,Asus Zenpad 8.0 Z380C,blandit mi in porttitor pede justo eu massa donec dapibus duis at velit eu est congue,Blue,828,3.2
25,Haier V2000,nulla sed vel enim sit amet nunc viverra dapibus nulla suscipit ligula in lacus curabitur at ipsum ac tellus,Crimson,212,2.7
26,Nokia 700,nulla dapibus dolor vel est donec odio justo sollicitudin ut suscipit a feugiat et eros vestibulum ac est lacinia nisi,Teal,910,2.8
27,Acer Iconia Tab 7 A1-713HD,dolor quis odio consequat varius integer ac leo pellentesque ultrices mattis odio donec vitae nisi,Pink,921,1.9
28,NEC N820,enim blandit mi in porttitor pede justo eu massa donec dapibus duis at velit eu,Khaki,979,2.6
29,Benefon Vega,habitasse platea dictumst maecenas ut massa quis augue luctus tincidunt nulla mollis molestie lorem quisque ut erat curabitur,Teal,938,1.1
30,Icemobile Flurry II,rhoncus dui vel sem sed sagittis nam congue risus semper porta volutpat quam pede lobortis ligula sit amet eleifend pede,Pink,173,1.3
31,vivo NEX 3 5G,primis in faucibus orci luctus et ultrices posuere cubilia curae duis,Green,969,1.5
32,Spice S-5420,volutpat eleifend donec ut dolor morbi vel lectus in quam fringilla rhoncus mauris enim leo rhoncus sed vestibulum sit,Red,314,4.1
33,Sagem my411c,tincidunt nulla mollis molestie lorem quisque ut erat curabitur gravida nisi at nibh in hac,Fuscia,409,3.4
34,Apple iPhone 12,viverra eget congue eget semper rutrum nulla nunc purus phasellus,Puce,313,1.6
35,O2 XDA Stealth,est et tempus semper est quam pharetra magna ac consequat metus sapien ut nunc vestibulum,Violet,645,1.5
36,Nokia 125,lacus purus aliquet at feugiat non pretium quis lectus suspendisse potenti in eleifend,Indigo,343,1.6
37,alcatel Pixi 7,et eros vestibulum ac est lacinia nisi venenatis tristique fusce congue diam id ornare imperdiet sapien,Green,267,5.0
38,Sony Xperia Z2,dolor morbi vel lectus in quam fringilla rhoncus mauris enim leo rhoncus sed vestibulum sit amet cursus id turpis integer,Yellow,970,3.4
39,alcatel OT-109,mauris enim leo rhoncus sed vestibulum sit amet cursus id turpis integer aliquet massa,Yellow,151,4.1
40,Gionee Pioneer P4S,metus sapien ut nunc vestibulum ante ipsum primis in faucibus orci,Khaki,703,4.0
41,Honor 8X,hendrerit at vulputate vitae nisl aenean lectus pellentesque eget nunc donec quis,Red,639,4.2
42,Samsung R220,proin risus praesent lectus vestibulum quam sapien varius ut blandit non interdum in ante vestibulum ante ipsum,Aquamarine,909,3.7
43,BLU Selfie,lacinia sapien quis libero nullam sit amet turpis elementum ligula vehicula consequat morbi a ipsum integer a nibh in quis,Goldenrod,462,1.5
44,NIU NiutekQ N108,egestas metus aenean fermentum donec ut mauris eget massa tempor convallis nulla neque libero convallis eget eleifend luctus ultricies eu,Turquoise,572,2.3
45,Nokia N87,dapibus augue vel accumsan tellus nisi eu orci mauris lacinia sapien,Pink,993,2.1
46,BenQ-Siemens EF51,erat volutpat in congue etiam justo etiam pretium iaculis justo in hac habitasse platea dictumst etiam,Green,401,2.2
47,Tecno Pova,convallis morbi odio odio elementum eu interdum eu tincidunt in leo maecenas pulvinar,Puce,144,1.4
48,Nokia X5 TD-SCDMA,eget massa tempor convallis nulla neque libero convallis eget eleifend luctus ultricies,Khaki,355,1.5
49,LG Optimus G Pro E985,eget orci vehicula condimentum curabitur in libero ut massa volutpat convallis morbi odio odio elementum eu,Teal,249,4.8
50,Apple iPhone 5c,varius integer ac leo pellentesque ultrices mattis odio donec vitae nisi nam ultrices,Khaki,597,2.8
